主題,類別,標題,關鍵句,情緒分數,分類結果,URL,來源,日期
10,科技,美國診所提供接種流感疫苗者大腸癌篩檢套組，有助提升大腸癌篩檢率,（來源：shutterstock）,0,中性,https://technews.tw/2024/10/17/why-your-flu-shot-might-come-with-a-colon-cancer-test/,TECHNEWS,2024-10-17
10,科技,Visa 財報優於預期，突顯美消費趨勢仍穩健,信用卡巨頭 Visa 繳出優於預期的財報，並稱消費趨勢穩健，可望持續至新的財年；Visa 股價盤後上漲近 2%,0,中性,https://finance.technews.tw/2024/10/30/visa-fiscal-fourth-quarter-2024-financial-results/,TECHNEWS,2024-10-30
10,科技,Qorvo 財測遜、擬砍成本，盤後跌 16% 下探兩年低點,分析師預期Qorvo第3季營收、non-GAAP每股稀釋盈餘各為10.6億美元、1.92美元,0,中性,https://finance.technews.tw/2024/10/30/qorvo-announces-fiscal-2025-second-quarter-financial-results/,TECHNEWS,2024-10-30
11,科技,紐時：中國駭客出手，川普家族與拜登幕僚都遭殃,報導指出，這項縝密的駭客行動已驚動美國國安人員,0,中性,https://infosecu.technews.tw/2024/10/30/trump-family-and-biden-aides-hacked/,TECHNEWS,2024-10-30
11,科技,華郵：川普一名顧問通話遭中國駭客攔劫,美國政府也還在了解這些駭客取得多少通話內容,0,中性,https://infosecu.technews.tw/2024/10/28/chinese-hackers-said-to-have-collected-audio-of-american-calls/,TECHNEWS,2024-10-28
11,科技,警告伊朗意圖強烈，美軍派 B-2 轟炸胡賽組織地下設施,美國國防部長奧斯汀（Lloyd Austin）在聲明中表示，美軍 B-2 轟炸機成功摧毀葉門境內五座胡賽組織地下彈藥庫，這是反制一年多來胡賽組織在伊朗支援下，多次攻擊經過紅海、曼德海峽和亞丁灣區域美國和各國商船的行動,0,中性,https://technews.tw/2024/10/18/us-destroyed-houthis-underground-targets-with-b2-spirit-bombers/,TECHNEWS,2024-10-18
11,科技,紐時：傳比爾蓋茲祕捐 16 億，助賀錦麗競選,據知情人士說法，比爾蓋茲說這筆捐款是給「未來前進」（Future Forward），也就是支持賀錦麗的一個主要外部募款組織,1,正面,https://technews.tw/2024/10/23/bill-gates-privately-says-he-has-backed-harris-with-50-million-donation/,TECHNEWS,2024-10-23
11,科技,美以官方皆證實，伊朗所有 S-300 已摧毀,美國和以色列政府 28 日證實，上週末以色列空軍對伊朗進行的大規模空襲報復行動，除了多座無人機生產設施，也把伊朗僅有的四套俄製 S-300 防空飛彈系統全數摧毀,0,中性,https://technews.tw/2024/10/29/israeli-and-us-officials-confirmed-that-all-iranian-s300s-were-destroyed/,TECHNEWS,2024-10-29
12,科技,三星第三季營收創單季新高，半導體沒跟上 AI 列車獲利大減 40%,而營業利益 9.1834 兆韓圜，較 2023 年同期的 2.43 兆韓圜成長 277.37%，凈利潤較 2023年同期成長 72.84%，金額來到 10.1009 兆韓圜,4,正面,https://finance.technews.tw/2024/10/31/samsungs-third-quarter-revenue-hits-single-quarter-high/,TECHNEWS,2024-10-31
12,科技,旺宏 9 月營收小幅月減 1.6%，前九個月營收年減 8.5%,在上一季法說會中，旺宏總經理盧志遠表示，第二季營收受到地震影響，雖然有保險理賠下，第二季仍提列約新台幣 3 億元相關損失,-2,負面,https://finance.technews.tw/2024/10/07/macronixs-revenue-in-september-fell-slightly-by-1-6-month-on-month/,TECHNEWS,2024-10-07
12,科技,聯發科預估第四季營收季減 4% 到季增 2%，上半年現金股利 29 元,"預期第四季營收以美元對台幣匯率 1 比 31.7 基礎計算，金額將介於新台幣 1,265 億元到 1,345 億元之間，較第三季下降 4%至 成長 2%，較 2023 年同期下降 2% 到成長 4%",0,中性,https://finance.technews.tw/2024/10/30/mediatek-expects-fourth-quarter-revenue-to-fall-4-quarter-on-quarter-to-rise-2-quarter-to-quarter/,TECHNEWS,2024-10-30
12,科技,"iPhone 16 帶動，鴻海 9 月營收 7,330 億元、Q3 創歷年新高",鴻海指出，受惠於 9 月份新品發表，帶動該公司「消費智能產品類別」強勁成長；AI 伺服器需求持續，「雲端網路產品類別」月對月表現顯著成長；受惠於消費智能產品類別零組件出貨增加，「元件及其他產品類別」呈月對月表現顯著成長,6,正面,https://finance.technews.tw/2024/10/05/foxconn-2024-q3/,TECHNEWS,2024-10-05
12,科技,買方去化庫存優先、採購態度轉被動，Q4 記憶體價格漲幅收斂,然而近期雖有伺服器 OEM 維持拉貨動能，但智慧手機品牌仍在觀望，TrendForce 預估第四季記憶體均價漲幅大幅縮減，一般型 DRAM（conventional DRAM）漲幅為 0~5%，但受惠 HBM 比重逐漸提高，DRAM 整體平均價格上漲 8%~13%，較前季漲幅明顯收斂,2,正面,https://technews.tw/2024/10/09/2024q4-dram-price/,TECHNEWS,2024-10-09
